,acronym,country_name,id,name,grant_id,grant_year,grant_title
167,CNRS,France,grid.4444.0,French National Centre for Scientific Research,US-9714261-B2,2015,Ionic liquid supported organotin reagents for the manufacturing of radiopharmaceuticals compounds
168,,France,grid.34566.32,University of Maine,US-9714261-B2,2015,Ionic liquid supported organotin reagents for the manufacturing of radiopharmaceuticals compounds
169,INSERM,France,grid.7429.8,French Institute of Health and Medical Research,US-9714261-B2,2015,Ionic liquid supported organotin reagents for the manufacturing of radiopharmaceuticals compounds
170,,France,grid.7252.2,University of Angers,US-9714261-B2,2015,Ionic liquid supported organotin reagents for the manufacturing of radiopharmaceuticals compounds
171,CHU,France,grid.277151.7,Centre Hospitalier Universitaire de Nantes,US-9714261-B2,2015,Ionic liquid supported organotin reagents for the manufacturing of radiopharmaceuticals compounds
172,SU,United States,grid.168010.e,Stanford University,US-9693034-B2,2012,Apparatus and method for localizing objects for distance and/or in three dimensions using a spiral point spread function
173,,Switzerland,grid.5801.c,Swiss Federal Institute of Technology in Zurich,US-9971136-B2,2014,Method and device to achieve spatially confined photointeraction at the focal volume of a microscope
174,CIT,United States,grid.20861.3d,California Institute of Technology,US-9971136-B2,2014,Method and device to achieve spatially confined photointeraction at the focal volume of a microscope
175,,United States,grid.421234.2,ExxonMobil (United States),US-10022701-B2,2015,Coating methods using organosilica materials and uses thereof
176,,United States,grid.471206.6,Guardian Industries (United States),US-8834976-B2,2011,Articles including anticondensation and/or low-E coatings and/or methods of making the same
177,,United States,grid.471206.6,Guardian Industries (United States),US-9353000-B2,2015,Articles including anticondensation coatings and/or methods of making the same
178,,United States,grid.417533.7,Draper Laboratory,WO-2018075115-A2,2017,ALL-FIBER PHASE-MODULATED FIBER OPTIC SENSOR AND PHASED ARRAY
179,,United States,grid.421234.2,ExxonMobil (United States),US-10047304-B2,2015,Aromatic hydrogenation catalysts and uses thereof
180,,United States,grid.38142.3c,Harvard University,US-10041108-B2,2014,Methods and compositions relating to optical super-resolution patterning
181,,United States,grid.471206.6,Guardian Industries (United States),US-9266773-B2,2014,Articles including anticondensation and/or low-E coatings and/or methods of making the same
182,,Germany,grid.424549.a,Carl Zeiss (Germany),US-9201011-B2,2011,Increased depth-resolution microscopy
183,,United States,grid.471206.6,Guardian Industries (United States),US-8939606-B2,2012,"Heatable lens for luminaires, and/or methods of making the same"
184,,South Korea,grid.419666.a,Samsung (South Korea),US-10036884-B2,2013,Display including electrowetting prism array
185,,United States,grid.471206.6,Guardian Industries (United States),US-8293344-B2,2010,Articles including anticondensation coatings and/or methods of making the same
186,ESI,United States,grid.480080.4,Electro Scientific Industries (United States),US-9776277-B2,2014,Phased array steering apparatus for laser beam positioning systems
187,USA,United States,grid.420176.6,United States Army,US-9715048-B2,2015,Broadband optics for manipulating light beams and images
188,,United States,grid.455373.3,Beam Engineering for Advanced Measurements (United States),US-9715048-B2,2015,Broadband optics for manipulating light beams and images
189,,Japan,grid.410834.a,Panasonic (Japan),WO-2014024379-A1,2013,"MESOPOROUS SILICA FINE PARTICLES, METHOD FOR PRODUCING MESOPOROUS SILICA FINE PARTICLES, MESOPOROUS SILICA FINE PARTICLE-CONTAINING COMPOSITION, MESOPOROUS SILICA FINE PARTICLE-CONTAINING MOLDING, AND ORGANIC ELECTROLUMINESCENCE ELEMENT"
190,,United States,grid.65499.37,Dana-Farber Cancer Institute,US-10024796-B2,2011,Nucleic acid nanostructure barcode probes
191,,United States,grid.38142.3c,Harvard University,US-10024796-B2,2011,Nucleic acid nanostructure barcode probes
192,,United States,grid.417480.e,Raytheon (United States),US-10069270-B2,2016,Planar waveguides with enhanced support and/or cooling features for high-power laser systems
193,,United States,grid.417480.e,Raytheon (United States),US-10056731-B2,2016,Planar waveguide (PWG) amplifier-based laser system with adaptive optic wavefront correction in low-power beam path
194,,South Korea,grid.419666.a,Samsung (South Korea),US-9557572-B2,2014,Three dimensional (3D) image display device and liquid crystal lens panel therefor
195,,United States,grid.417480.e,Raytheon (United States),US-9835856-B2,2013,Adaptive optic having meander resistors
196,,United States,grid.417480.e,Raytheon (United States),US-9632345-B2,2013,"Liquid crystal control structure, tip-tilt-focus optical phased array and high power adaptive optic"
197,,United States,grid.421234.2,ExxonMobil (United States),WO-2016094778-A1,2015,ORGANOSILICA MATERIALS AND USES THEREOF
198,J&J,United States,grid.417429.d,Johnson & Johnson (United States),US-20150077700-A1,2014,METHODS AND APPARATUS FOR OPHTHALMIC DEVICES INCLUDING CYCLOIDALLY ORIENTED LIQUID CRYSTAL LAYERS
199,,United States,grid.455373.3,Beam Engineering for Advanced Measurements (United States),US-20150077700-A1,2014,METHODS AND APPARATUS FOR OPHTHALMIC DEVICES INCLUDING CYCLOIDALLY ORIENTED LIQUID CRYSTAL LAYERS
200,,United States,grid.471206.6,Guardian Industries (United States),US-8815059-B2,2010,System and/or method for heat treating conductive coatings using wavelength-tuned infrared radiation
201,,United States,grid.38142.3c,Harvard University,US-9137516-B2,2013,Sub-diffraction limit image resolution in three dimensions
202,,United States,grid.471192.8,Delphi (United States),US-8823641-B2,2012,System for projecting 3D images and detecting gestures
203,,United States,grid.38142.3c,Harvard University,US-10073035-B2,2016,Sub-diffraction limit image resolution and other imaging techniques
204,,United States,grid.420451.6,Google,US-9335548-B1,2013,Head-wearable display with collimated light source and beam steering mechanism
205,,Belgium,grid.5342.0,Ghent University,WO-2013001046-A1,2012,METHODS AND SYSTEMS FOR TRIMMING PHOTONIC DEVICES
206,,United States,grid.417480.e,Raytheon (United States),US-9470953-B2,2013,High power optical switch
207,,South Korea,grid.419666.a,Samsung (South Korea),US-9664912-B2,2013,Image display and liquid crystal lens therefor
208,,United States,grid.421234.2,ExxonMobil (United States),WO-2016094843-A3,2015,OLEFIN POLYMERIZATION CATALYST SYSTEM COMPRISING MESOPOROUS ORGANOSILICA SUPPORT
209,,United States,grid.471206.6,Guardian Industries (United States),US-8980386-B2,2013,Articles including anticondensation coatings and/or methods of making the same
210,UCB,United States,grid.266190.a,University of Colorado Boulder,US-8620065-B2,2011,"Methods and systems for three dimensional optical imaging, sensing, particle localization and manipulation"
211,CU,United States,grid.266185.e,University of Colorado System,US-8620065-B2,2011,"Methods and systems for three dimensional optical imaging, sensing, particle localization and manipulation"
212,,United States,grid.249880.f,Jackson Laboratory,EP-2631633-A1,2009,3D biplane microscopy
213,UMS,United States,grid.411025.3,University of Maine System,EP-2631633-A1,2009,3D biplane microscopy
214,,United States,grid.38142.3c,Harvard University,US-8564792-B2,2008,Sub-diffraction limit image resolution in three dimensions
215,,United States,grid.471206.6,Guardian Industries (United States),US-8445083-B2,2012,Articles including anticondensation coatings and/or methods of making the same
216,SU,United States,grid.168010.e,Stanford University,US-8153446-B2,2009,Fluorogenic compounds converted to fluorophores by photochemical or chemical means and their use in biological systems
217,KSU,United States,grid.258518.3,Kent State University,US-8153446-B2,2009,Fluorogenic compounds converted to fluorophores by photochemical or chemical means and their use in biological systems
218,,United States,grid.264772.2,Texas State University,US-9811730-B2,2015,Person identification using ocular biometrics with liveness detection
219,TSUS,United States,grid.469273.d,Texas State University System,US-9811730-B2,2015,Person identification using ocular biometrics with liveness detection
220,NU,United States,grid.16753.36,Northwestern University,US-8609902-B2,2010,"Organoactinide-, organolanthanide-, and organogroup-4-mediated hydrothiolation of terminal alkynes with aliphatic, aromatic and benzylic thiols"
221,SU,United States,grid.168010.e,Stanford University,US-8772048-B2,2012,Fluorogenic compounds converted to fluorophores by photochemical or chemical means and their use in biological systems
222,KSU,United States,grid.258518.3,Kent State University,US-8772048-B2,2012,Fluorogenic compounds converted to fluorophores by photochemical or chemical means and their use in biological systems
223,,United States,grid.421234.2,ExxonMobil (United States),WO-2016094830-A1,2015,METHODS OF SEPARATING AROMATIC COMPOUNDS FROM LUBE BASE STOCKES
224,,Denmark,grid.426261.5,Oticon (Denmark),EP-3185590-A1,2016,A HEARING DEVICE COMPRISING A SENSOR FOR PICKING UP ELECTROMAGNETIC SIGNALS FROM THE BODY
225,,United States,grid.264772.2,Texas State University,US-9082011-B2,2013,Person identification using ocular biometrics with liveness detection
226,,United States,grid.421234.2,ExxonMobil (United States),WO-2016094778-A1,2015,ORGANOSILICA MATERIALS AND USES THEREOF
