id,title,year,doi
pub.1043655062,Patient specific identification of the cardiac driver function in a cardiovascular system model,2011,10.1016/j.cmpb.2010.06.005
pub.1034568376,"A Comparison of the Prognostic Value of Early PSA Test-Based Variables Following External Beam Radiotherapy, With or Without Preceding Androgen Deprivation: Analysis of Data From the TROG 96.01 Randomized Trial",2011,10.1016/j.ijrobp.2009.10.071
pub.1033878135,Pulmonary embolism diagnostics from the driver function,2011,10.1186/cc9438
pub.1012454023,Validation of a virtual patient and virtual trials method for accurate prediction of tight glycemic control protocol performance,2011,10.1186/cc9813
pub.1002250638,The history of diagnosing carotid sinus hypersensitivity: why are the current criteria too sensitive?,2011,10.1093/europace/euq409
pub.1052972749,"Ethnic Differences in Characteristics, Treatments and Outcomes of Patients Hospitalised for Heart Failure: New Zealand Heart Failure Registry",2011,10.1016/j.hlc.2011.05.162
pub.1048266091,"Insulin Sensitivity, Its Variability and Glycemic Outcome: A model-based analysis of the difficulty in achieving tight glycemic control in critical care",2011,10.3182/20110828-6-it-1002.01281
pub.1007610096,Determination of dexamethasone and dexamethasone sodium phosphate in human plasma and cochlear perilymph by liquid chromatography/tandem mass spectrometry,2011,10.1016/j.jchromb.2010.11.003
pub.1035783940,"Characteristics, Treatments and Outcomes of Patients Hospitalised for Heart Failure: New Zealand Heart Failure Registry",2011,10.1016/j.hlc.2011.05.151
pub.1018896090,Embolization of Proximal Type 1 Endoleak Using N-butyl 2-cyanoacrylate after Endovascular Repair of the Thoracic Aorta: Two Case Reports,2011,10.1016/j.jvir.2010.09.024
pub.1020104616,"Comorbidity, age and overall survival in cetuximab-treated patients with advanced colorectal cancer (ACRC)—results from NCIC CTG CO.17: a phase III trial of cetuximab versus best supportive care",2011,10.1093/annonc/mdq309
pub.1034953739,Allopurinol might improve response to azathioprine and 6‐mercaptopurine by correcting an unfavorable metabolite ratio,2011,10.1111/j.1440-1746.2010.06489.x
pub.1011305903,Effects of Atrio-Ventricular Delay and Interventricular Delay on Continuous Left Atrial Pressure and Waveforms in Ambulant Heart Failure Patients: A Novel Method for Cardiac Resynchronisation Therapy Optimisation,2011,10.1016/j.hlc.2011.05.160
pub.1038889272,"Multiple Cases of Stress Cardiomyopathy after a Destructive Earthquake: When the Earthquakes, the Heart Breaks",2011,10.1016/j.hlc.2011.05.514
pub.1006778707,"The Psychology of Earthquake Stress Cardiomyopathy, Non-cardiac Chest Pain and Myocardial Infarction",2011,10.1016/j.hlc.2011.05.109
pub.1011349859,Cardiology Admissions Following the 2010 and 2011 Christchurch Earthquakes,2011,10.1016/j.hlc.2011.05.495
pub.1034551570,"Use of the operative logbook to monitor trainee progress, and evaluate operative supervision provided by accredited training posts",2011,10.1016/j.surge.2010.11.012
pub.1014719440,Management of Elderly and Non-elderly Patients with Heart Failure Admissions: The New Zealand Heart Failure Registry,2011,10.1016/j.hlc.2011.05.178
pub.1064825831,Negative pressure wound therapy as an adjunct to compression for healing chronic venous ulcers,2011,10.12968/jowc.2011.20.1.35
pub.1002896611,Processing aortic and pulmonary artery waveforms to derive the ventricle time-varying elastance,2011,10.3182/20110828-6-it-1002.02661
pub.1053593769,EPITHET,2011,10.1161/strokeaha.110.580464
pub.1029417939,Management of Heart Failure with Preserved and Impaired Systolic Function: The New Zealand Heart Failure Registry,2011,10.1016/j.hlc.2011.05.179
pub.1021173711,Interpreting Lung Function Data Using 80% Predicted and Fixed Thresholds Misclassifies More Than 20% of Patients,2011,10.1378/chest.10-0189
pub.1053560486,Increases in Radiation Badge Counts are Associated with a Switch from Femoral to Radial Artery Access for PCI,2011,10.1016/j.hlc.2011.05.321
pub.1024623948,"Association of angiopoietin-2, C-reactive protein and markers of obesity and insulin resistance with survival outcome in colorectal cancer",2011,10.1038/sj.bjc.6606005
pub.1010068829,Impact of Inflammatory Bowel Disease upon Growth in Children and Adolescents,2011,10.5402/2011/365712
pub.1025371177,Are Gentamicin and/or Vancomycin Associated with Ototoxicity in the Neonate? A Retrospective Audit,2011,10.1159/000324857
pub.1043350749,"Benign Paroxysmal Positional Vertigo (BPPV): History, Pathophysiology, Office Treatment and Future Directions",2011,10.1155/2011/835671
pub.1007212904,Tight Glycemic Control in Intensive Care: From Engineering to Clinical Practice Change,2011,10.1007/978-3-642-23508-5_5
pub.1078356036,Medical image. A thrilling mass.,2010,
pub.1015751808,"Accurate, reproducible measurement of acetone concentration in breath using selected ion flow tube-mass spectrometry",2010,10.1088/1752-7155/4/4/046001
pub.1019801047,"Stability of plasma adrenocorticotrophic hormone (ACTH): Influence of hemolysis, rapid chilling, time, and the addition of a maleimide",2010,10.1016/j.clinbiochem.2010.09.020
pub.1002962459,Intravenous Lipid Emulsion Does Not Augment Blood Pressure Recovery in A Rabbit Model of Metoprolol Toxicity,2010,10.1007/s13181-010-0049-y
pub.1003584121,Pilocytic Astrocytomas Have Telomere-Associated Promyelocytic Leukemia Bodies without Alternatively Lengthened Telomeres,2010,10.2353/ajpath.2010.100468
pub.1017196133,Validation of a model-based virtual trials method for tight glycemic control in intensive care,2010,10.1186/1475-925x-9-84
pub.1042679845,"MS prevalence in New Zealand, an ethnically and latitudinally diverse country",2010,10.1177/1352458510379614
pub.1038272442,Effects of olfactory and gustatory stimuli on neural excitability for swallowing,2010,10.1016/j.physbeh.2010.09.008
pub.1053271120,"Association of FcgR2a, but not FcgR3a, with inflammatory bowel diseases across three Caucasian populations†",2010,10.1002/ibd.21342
pub.1040293983,Selective inhibition of the cellular sodium pump by emicymarin and 14ß anhydroxy bufadienolides,2010,10.1016/j.steroids.2010.07.010
pub.1037763806,A profile of prognostic and molecular factors in European and Māori breast cancer patients,2010,10.1186/1471-2407-10-543
pub.1052678758,Cardiac output estimation using pulmonary mechanics in mechanically ventilated patients,2010,10.1186/1475-925x-9-80
pub.1004183715,Fraction size in radiation treatment for breast conservation in early breast cancer,2010,10.1002/14651858.cd003860.pub3
pub.1078348195,A case of a testosterone-secreting oncocytic adrenocortical carcinoma.,2010,
pub.1010432209,Myoclonus and delirium associated with ciprofloxacin,2010,10.1093/ageing/afq107
pub.1021963564,Current application of diagnostic laparoscopy in suspected appendicitis and laparoscopic appendicectomy,2010,10.1111/j.1463-1318.2009.02118.x
pub.1013709849,Serious infections in patients with inflammatory bowel disease receiving anti‐tumor‐necrosis‐factor‐alpha therapy: An Australian and New Zealand experience,2010,10.1111/j.1440-1746.2010.06407.x
pub.1051106804,"Comparison of a linear and a non-linear model for using sensory–motor, cognitive, personality, and demographic data to predict driving ability in healthy older adults",2010,10.1016/j.aap.2010.04.017
pub.1000206486,A Comparison of the Conformability of Everolimus-Eluting Bioresorbable Vascular Scaffolds to Metal Platform Coronary Stents,2010,10.1016/j.jcin.2010.07.016
pub.1007942849,Allopurinolthiopurine combination therapy in inflammatory bowel disease: are there genetic clues to this puzzle?,2010,10.2217/pgs.10.143
pub.1004824481,ED overcrowding and the ‘inappropriate patient’ – Whose definition?,2010,10.1016/j.aenj.2010.08.278
pub.1036672086,"Chronic myeloid leukemia in the Asia-Pacific region: Current practice, challenges and opportunities in the targeted therapy era",2010,10.1016/j.leukres.2010.03.033
pub.1052557404,Design and Clinical Pilot Testing of the Model-Based Dynamic Insulin Sensitivity and Secretion Test (DISST),2010,10.1177/193229681000400616
pub.1078244723,Christchurch experience of pulmonary embolism with and without thrombolysis.,2010,
pub.1061740468,Measurement of BOLD Changes Due to Cued Eye-Closure and Stopping During a Continuous Visuomotor Task via Model-Based and Model-Free Approaches,2010,10.1109/tnsre.2010.2050782
pub.1017124313,Sleep syncope: Important clinical associations with phobia and vagotonia,2010,10.1016/j.sleep.2010.04.013
pub.1021862684,Ochroconis gallopava peritonitis in a cardiac transplant patient on continuous ambulatory peritoneal dialysis,2010,10.1111/j.1399-3062.2010.00523.x
pub.1034682297,KCNN4 Gene Variant Is Associated With Ileal Crohn's Disease in the Australian and New Zealand Population,2010,10.1038/ajg.2010.161
pub.1003949709,Extra-oral approach to removal of parotid duct stones,2010,10.1017/s0022215110000563
pub.1001478598,Population‐based epidemiology study of autoimmune hepatitis: A disease of older women?,2010,10.1111/j.1440-1746.2010.06384.x
pub.1047522712,Joint parameter confidence regions improve the power of parametric regression in method-comparison studies,2010,10.1007/s00769-010-0674-9
pub.1035493303,Left ventricular systolic and diastolic function assessed by tissue Doppler imaging and outcome in asymptomatic aortic stenosis,2010,10.1093/eurheartj/ehq159
pub.1005803293,Onset of Wegener’s granulomatosis during therapy with golimumab for rheumatoid arthritis: a rare adverse event?,2010,10.1093/rheumatology/keq101
pub.1048841888,Trauma may cause Spigelian herniae in children,2010,10.1111/j.1445-2197.2010.05414.x
pub.1021561647,"Parents’ and health professionals’ perceptions of family centred care for children in hospital, in developed and developing countries: A review of the literature",2010,10.1016/j.ijnurstu.2010.05.005
pub.1044477136,Exploring the Critical Distance and Position Relationships Between the Eustachian Tube and the Internal Carotid Artery,2010,10.1097/mao.0b013e3181f6c880
pub.1038588203,Evidence that glioma-associated oncogene homolog 1 is not a universal risk gene for inflammatory bowel disease in Caucasians,2010,10.1038/gene.2010.15
pub.1028866594,Imbalance of the autonomic nervous system at night in women with gestational diabetes,2010,10.1111/j.1464-5491.2010.03062.x
pub.1064027713,A Curious Presentation of Diabetes,2010,10.1177/1474651410366428
pub.1078423672,Cochlear Implantation in children with CHARGE syndrome.,2010,10.1002/cii.423
pub.1022525356,How should single‐access or natural orifice cholecystectomy be introduced?,2010,10.1111/j.1477-2574.2010.00208.x
pub.1031736697,Spectroscopic (multi-energy) CT distinguishes iodine and barium contrast material in MICE,2010,10.1007/s00330-010-1768-9
pub.1053353651,Radiation Myelopathy after 36Gy in 12 Fractions Palliative Chest Radiotherapy for Squamous Cell Cancer of the Lung: Case Report and Review of Published Studies,2010,10.1016/j.clon.2010.05.015
pub.1025694468,Facial fractures in work-related injuries,2010,10.1016/j.ajoms.2010.02.002
pub.1019160205,A fast generalizable solution method for glucose control algorithms,2010,10.1016/j.mbs.2010.06.001
pub.1078239504,Improved speech discrimination after cochlear implantation in the Southern Cochlear Implant Adult Programme.,2010,
pub.1037169892,"A double‐blind, placebo‐controlled study to assess the mitochondria‐targeted antioxidant MitoQ as a disease‐modifying therapy in Parkinson's disease",2010,10.1002/mds.23148
pub.1078203373,"Patients ""falling through the cracks"". The Canterbury Charity Hospital: initial progress report.",2010,
pub.1037163513,Reply,2010,10.1002/art.27539
pub.1078305008,"Lapses of responsiveness: Characteristics, detection, and underlying mechanisms",2010,10.1109/iembs.2010.5626385
pub.1024780393,Dietary factors in chronic inflammation: Food tolerances and intolerances of a New Zealand Caucasian Crohn's disease population,2010,10.1016/j.mrfmmm.2010.01.020
pub.1039950083,An unusual case of cotton wool use to improve hearing,2010,10.1017/s0022215109992453
pub.1078305124,Different models for predicting driving performance in people with brain disorders,2010,10.1109/iembs.2010.5626280
pub.1009274881,Factors Influencing Local and Systemic Levels of Plasma Myeloperoxidase in ST-Segment Elevation Acute Myocardial Infarction,2010,10.1016/j.amjcard.2010.03.028
pub.1031924136,Computed tomographic colonography in the diagnosis of colorectal cancer,2010,10.1002/bjs.7098
pub.1009631539,Traumatic Splenic Injury Managed with Arterial Embolisation in a Patient with Idiopathic Thrombocytopenic Pupura,2010,10.1007/s00270-009-9735-z
pub.1026494987,3-Dimensional Optical Coherence Tomography Assessment of Jailed Side Branches by Bioresorbable Vascular Scaffolds A Proposal for Classification,2010,10.1016/j.jcin.2010.05.011
pub.1030682780,Organ failure and tight glycemic control in the SPRINT study,2010,10.1186/cc9224
pub.1078304755,Towards improved sedation control in critically ill patients,2010,10.1109/iembs.2010.5626030
pub.1049398034,Recurrence of the Splendore–Hoeppli phenomenon,2010,10.1111/j.1442-9071.2010.02317.x
pub.1078304860,Behavioural microsleeps in normally-rested people,2010,10.1109/iembs.2010.5625953
pub.1078304861,"The relationship between behavioural microsleeps, visuomotor performance and EEG theta",2010,10.1109/iembs.2010.5625956
pub.1078202788,Angiomatosis: a case report.,2010,
pub.1035211716,Model-Based Prediction of the Patient-Specific Response to Adrenaline,2010,10.2174/1874431101004010149
pub.1015191602,"Capecitabine, Bevacizumab, and Mitomycin in First-Line Treatment of Metastatic Colorectal Cancer: Results of the Australasian Gastrointestinal Trials Group Randomized Phase III MAX Study",2010,10.1200/jco.2009.27.7723
pub.1001814775,The ‘apparent clearance’ of free phenytoin in elderly vs. younger adults,2010,10.1111/j.1365-2125.2010.03673.x
pub.1038238434,BMI ≥ 50 kg/m2 is associated with a younger age of onset of overweight and a high prevalence of adverse metabolic profiles,2010,10.1017/s1368980009993193
pub.1048326971,Long-term functional outcomes in children with Currarino syndrome,2010,10.1007/s00383-010-2615-4
pub.1030410828,Ileal disease is associated with surgery for perianal disease in a population‐based Crohn's disease cohort,2010,10.1002/bjs.7031
pub.1026937534,Nutritional therapy for the treatment of pediatric Crohn’s disease,2010,10.1586/eci.10.37
pub.1027922290,Establishing benchmarks for the outcome of herniotomy in children,2010,10.1002/bjs.7041
pub.1033786097,Unique parameter identification for cardiac diagnosis in critical care using minimal data sets,2010,10.1016/j.cmpb.2010.01.002
pub.1015551312,Monitoring chloramines and bromamines in a humid environment using selected ion flow tube mass spectrometry,2010,10.1002/rcm.4570
pub.1078192406,How well is cognitive function documented by medical staff in the over-65 age group at the time of acute medical admission?,2010,
pub.1078190795,How to achieve New Zealand's shorter stays in emergency departments health target.,2010,
pub.1006773261,"Urinary cystatin C is diagnostic of acute kidney injury and sepsis, and predicts mortality in the intensive care unit",2010,10.1186/cc9014
pub.1035800333,Patterns of recurrence in patients with acute diverticulitis,2010,10.1002/bjs.7035
pub.1023281658,Role of an acute assessment and review area for general surgical patients,2010,10.1111/j.1445-2197.2010.05310.x
pub.1012360865,"Randomised, placebo‐controlled, crossover trial of sildenafil citrate in the treatment of erectile dysfunction following external beam radiation treatment of prostate cancer",2010,10.1111/j.1754-9485.2010.02168.x
pub.1015785551,Ectopic cervical thymus: case report and review of pathogenesis and management,2010,10.1017/s0022215109992180
pub.1010604775,‘GAP’ in radiotherapy services in Australia and New Zealand in 2009,2010,10.1111/j.1754-9485.2010.02172.x
pub.1032054465,Early intervention with erythropoietin does not affect the outcome of acute kidney injury (the EARLYARF trial),2010,10.1038/ki.2010.25
pub.1031826460,Evidence of interaction of CARD8 rs2043211 with NALP3 rs35829419 in Crohn's disease,2010,10.1038/gene.2010.11
pub.1037442193,Alanine transaminase rather than abdominal ultrasound alone is an important investigation to justify cholecystectomy in patients presenting with acute pancreatitis,2010,10.1111/j.1477-2574.2010.00173.x
pub.1078185299,Dental alloys used for crown and bridge restorations by dental technicians in New Zealand.,2010,
pub.1021369761,De novo mutations of SETBP1 cause Schinzel-Giedion syndrome,2010,10.1038/ng.581
pub.1046780394,Gleason scoring: a comparison of classical and modified (International Society of Urological Pathology) criteria using nadir PSA as a clinical end point,2010,10.3109/00313021003787924
pub.1060340832,Polymorphisms within the folate pathway predict folate concentrations but are not associated with disease activity in rheumatoid arthritis patients on methotrexate,2010,10.1097/fpc.0b013e3283398a71
pub.1032601899,Efficacy of Transcaruncular approach to reconstruct isolated medial orbital fracture,2010,10.1007/s12663-010-0041-8
pub.1014207045,Validation of the GRAPE single view aerosol retrieval for ATSR-2 and insights into the long term global AOD trend over the ocean,2010,10.5194/acp-10-4849-2010
pub.1009683522,Omeprazole‐induced acute interstitial nephritis is not related to CYP2C19 genotype or CYP2C19 phenotype,2010,10.1111/j.1365-2125.2010.03623.x
pub.1059293640,"Retroperitoneal Laparoscopic Nephrectomy: The Effect of the Learning Curve, and Concentrating Expertise, on Operating Times",2010,10.1089/lap.2009.0364
pub.1004127900,Internal carotid artery dissection following canalith repositioning procedure,2010,10.1017/s0022215109991356
pub.1033723335,Continuous Glucose Monitors and the Burden of Tight Glycemic Control in Critical Care: Can They Cure the Time Cost?,2010,10.1177/193229681000400317
pub.1001583179,Influence of general health and degree of surgical insult on long‐term survival,2010,10.1002/bjs.6960
pub.1036716736,Consolidation of Evidence for Association of the KIAA1109-TENR-IL2-IL21 rs6822844 Variant With Crohn's Disease,2010,10.1038/ajg.2010.34
pub.1078169261,Individualising Target-Controlled Anaesthesia. Better Models or Better Targets?,2010,10.1177/0310057x1003800302
pub.1078180739,An audit of referrals to the Southern Cochlear Implant Paediatric Programme.,2010,
pub.1078180741,"Juvenile thyrotoxicosis--a South Island, New Zealand experience with long-term outcome.",2010,
pub.1046822858,Demonstrating the safety of manuka honey UMF® 20+in a human clinical trial with healthy individuals,2010,10.1017/s0007114509992777
pub.1078145285,Immune thrombocytopaenia in adults: a single-centre retrospective review of patients presenting over 7 years.,2010,
pub.1064825782,Diabetes outpatient care before and after admission for diabetic foot complications,2010,10.12968/jowc.2010.19.4.150
pub.1046640217,The Relationship of Omental and Subcutaneous Adipocyte Size to Metabolic Disease in Severe Obesity,2010,10.1371/journal.pone.0009997
pub.1004609912,Rituximab Plus Fludarabine and Cyclophosphamide Prolongs Progression-Free Survival Compared With Fludarabine and Cyclophosphamide Alone in Previously Treated Chronic Lymphocytic Leukemia,2010,10.1200/jco.2009.26.4556
pub.1002471629,Azathioprine and allopurinol: A two‐edged interaction,2010,10.1111/j.1440-1746.2010.06254.x
pub.1024106734,Rifaximin and Crohn’s Disease: A New Solution to an Old Problem?,2010,10.1007/s10620-010-1140-6
pub.1000776099,Is screening for hypothyroidism in the diabetes clinic effective?,2010,10.1002/pdi.1458
pub.1053718976,Is There a Role for Consensus Guidelines for P. jiroveci Pneumonia Prophylaxis in Immunosuppressed Patients with Rheumatic Diseases?,2010,10.3899/jrheum.091426
pub.1051028668,A fast and accurate diagnostic test for severe sepsis using model-based insulin sensitivity and clinical data,2010,10.1186/cc9116
pub.1049121044,Internal‐external percutaneous transhepatic biliary drainage for malignant biliary obstruction: a retrospective analysis,2010,10.1111/j.1754-9485.2010.02147.x
pub.1004805383,Physician-Directed Patient Self-Management of Left Atrial Pressure in Advanced Chronic Heart Failure,2010,10.1161/circulationaha.108.800490
pub.1064078343,What Makes Tight Glycemic Control Tight? The Impact of Variability and Nutrition in Two Clinical Studies,2010,10.1177/193229681000400208
pub.1061527884,Blood Glucose Prediction Using Stochastic Modeling in Neonatal Intensive Care,2010,10.1109/tbme.2009.2035517
pub.1078056615,Troponin measurement and the new assays: how low can we go?,2010,10.5694/j.1326-5377.2010.tb03500.x
pub.1044761948,Management in children of mild postnatal renal dilatation but without vesicoureteral reflux,2010,10.1007/s00467-009-1348-x
pub.1039456868,Multiorgan failure from 1-benzylpiperazine ingestion – legal high or lethal high?,2010,10.3109/15563651003592948
pub.1036923428,Future Developments in Chest Pain Diagnosis and Management,2010,10.1016/j.mcna.2010.01.010
pub.1016481107,Clinical efficacy and safety of the factor VIII/von Willebrand factor concentrate BIOSTATE® in patients with von Willebrand’s disease: a prospective multi‐centre study,2010,10.1111/j.1365-2516.2010.02206.x
pub.1003581551,An investigation of the pre-injury risk factors associated with children who experience traumatic brain injury,2010,10.1136/ip.2009.022483
pub.1027679242,Factors associated with radiation exposure in patients with inflammatory bowel disease,2010,10.1111/j.1365-2036.2009.04205.x
pub.1028848896,Methotrexate polyglutamate concentrations are not associated with disease control in rheumatoid arthritis patients receiving long‐term methotrexate therapy,2010,10.1002/art.27201
pub.1013409366,"Randomised, non-comparative phase II study of weekly docetaxel with cisplatin and 5-fluorouracil or with capecitabine in oesophagogastric cancer: the AGITG ATTAX trial",2010,10.1038/sj.bjc.6605522
pub.1002098199,Population‐based cases control study of inflammatory bowel disease risk factors,2010,10.1111/j.1440-1746.2009.06140.x
pub.1045780967,Use of a New High-Activity Arthroplasty Score to Assess Function of Young Patients With Total Hip or Knee Arthroplasty,2010,10.1016/j.arth.2008.09.019
pub.1000043740,Operating parameters of CVD diamond detectors for radiation dosimetry,2010,10.1016/j.nima.2009.12.008
pub.1039453725,Comprehensive standardized data definitions for acute coronary syndrome research in emergency departments in Australasia,2010,10.1111/j.1742-6723.2010.01256.x
pub.1078056295,The good apprentice in medical education.,2010,
pub.1029720393,Natural Killer Cells in Obesity: Impaired Function and Increased Susceptibility to the Effects of Cigarette Smoke,2010,10.1371/journal.pone.0008660
pub.1078051456,Medical image. An unusual case of large bowel obstruction.,2010,
pub.1052051554,A Novel Method to Adjust Efficacy Estimates for Uptake of Other Active Treatments in Long-Term Clinical Trials,2010,10.1371/journal.pone.0008580
pub.1050053689,An Unmet Need for Implantable Cardioverter Defibrillators in New Zealand,2010,10.1016/j.hlc.2010.06.507
pub.1053082834,Role Development of Nurses Supervising Exercise Tolerance Tests,2010,10.1016/j.hlc.2010.04.072
pub.1040668755,Nine Years of Unprotected Left Main Stem Coronary Stenting at Christchurch Hospital,2010,10.1016/j.hlc.2010.04.006
pub.1014243632,Hypoglycemia Detection in Critical Care Using Continuous Glucose Monitors: An in Silico Proof of Concept Analysis,2010,10.1177/193229681000400103
pub.1009451029,ASPECT (Asia Pacific Evaluation of Chest pain Trial) – New Zealand Arm,2010,10.1016/j.hlc.2010.06.716
pub.1040017185,A Survey of Patient Views on Receiving Vascular Outpatient Letters,2010,10.1016/j.ejvs.2009.09.019
pub.1013220987,ASPECT (ASia Pacific Evaluation of Chest pain Trial) – New Zealand ARM,2010,10.1016/j.hlc.2010.04.005
pub.1020141473,Predictors of Rehospitalisation after Acute Coronary Syndrome (ACS): Insights from the Australia-New Zealand (ANZ) Population of the Global Registry of Acute Coronary Events (GRACE),2010,10.1016/j.hlc.2010.06.542
pub.1078054016,Hyperbaric Oxygen Therapy in the Treatment of Post Cardiac Surgical Strokes – a Case Series and Review of the Literature,2010,10.1177/0310057x1003800127
pub.1040623038,High Sensitivity Troponin Out-Performs Conventional Assays in Predicting 2 Year Adverse Events,2010,10.1016/j.hlc.2010.06.730
pub.1019707131,Principles and Practice of Pediatric Neurosurgery. Second Edition,2010,10.1111/j.1445-2197.2009.05203.x
pub.1031387550,The Kiwi hoop for Boyle–Davies gag suspension during tonsillectomy,2010,10.1017/s0022215109991319
pub.1008294969,Fourteen Year Follow-up after Direct Percutaneous Intervention (DPCI) with Remote Surgical Backup for Anterior ST elevation myocardial infarction (STEMI),2010,10.1016/j.hlc.2010.06.979
pub.1007756032,SUCCESSFUL COCHLEAR IMPLANTATION IN A PATIENT WITH SUPERFICIAL SIDEROSIS OF THE CENTRAL NERVOUS SYSTEM,2010,10.1097/mao.0b013e3181be6898
pub.1049435996,Removal of Contrast Media from the Coronary Sinus Attenuates Renal Injury After Coronary Angiography and Intervention,2010,10.1016/j.hlc.2010.06.1021
pub.1038836919,Pictorial evolution of bilateral adrenal haemorrhage,2010,10.1111/j.1445-5994.2009.02117.x
pub.1033883540,Helicobacter species in the human colon,2010,10.1111/j.1463-1318.2008.01672.x
pub.1045341652,Long‐term behavioural outcomes of pre‐school mild traumatic brain injury,2010,10.1111/j.1365-2214.2009.00947.x
pub.1021413391,An Unmet Need for Implantable Cardioverter Defibrillators in New Zealand,2010,10.1016/j.hlc.2010.04.009
pub.1015701637,Fourteen Year Follow-Up After Direct Percutaneous Intervention (DPCI) with Remote Surgical Backup for Anterior ST Elevation Myocardial Infarction (STEMI),2010,10.1016/j.hlc.2010.04.019
