id,title,year,doi
pub.1078797822,A wearable device for measuring eye dynamics in real-world conditions,2013,10.1109/embc.2013.6611072
pub.1027303166,A common surgical curriculum for ASEAN nations has its risks,2013,10.1111/ans.12263
pub.1064826152,Treatment of ulcerated necrobiosis lipoidica with ovine forestomach matrix,2013,10.12968/jowc.2013.22.7.383
pub.1033046745,“Ocular tremor” in Parkinson's disease: A technology‐dependent artifact of universal head motion?,2013,10.1002/mds.25602
pub.1031809447,"Improving Interventional Management of Acute Coronary Syndrome (ACS) Patients in New Zealand (NZ): A Comparison of the 2002, 2007 and 2012 National ACS Audits",2013,10.1016/j.hlc.2013.04.024
pub.1024403423,Autoimmune hepatitis: the role of environmental risk factors: a population-based study,2013,10.1007/s12072-013-9448-x
pub.1040731199,What is an acceptable risk of major adverse cardiac event in chest pain patients soon after discharge from the Emergency Department? A clinical survey,2013,10.1016/j.ijcard.2012.09.171
pub.1042634954,External validation and sub-cohort analysis of stochastic forecasting models in NICU cohorts,2013,10.1016/j.bspc.2013.01.006
pub.1048566581,Validation of the Vancouver Chest Pain Rule using troponin as the only biomarker: a prospective cohort study,2013,10.1016/j.ajem.2013.04.016
pub.1012731848,On the Problem of Patient-Specific Endogenous Glucose Production in Neonates on Stochastic Targeted Glycemic Control,2013,10.1177/193229681300700414
pub.1051995185,Contemporary Echocardiography in Non-ST Elevation Myocardial Infarctions,2013,10.1016/j.hlc.2013.04.016
pub.1001184871,Trends of the Treatment of ST Elevation Myocardial Infarct (STEMI) in Christchurch 2008–2012,2013,10.1016/j.hlc.2013.04.081
pub.1007986044,Echocardiography in Non-ST Elevation Myocardial Infarction Presentation,2013,10.1016/j.hlc.2013.04.019
pub.1047352895,"Laparoscopic colorectal cancer surgery: panacea, placebo or just good fun?",2013,10.1586/17474124.2013.811035
pub.1053725270,PFO Closure – The Christchurch Experience,2013,10.1016/j.hlc.2013.04.010
pub.1041735789,A randomized phase II study comparing capecitabine alone with capecitabine and oral cyclophosphamide in patients with advanced breast cancer-cyclox II,2013,10.1093/annonc/mdt065
pub.1045613945,Single Centre Experience with Riata Defibrillator Leads,2013,10.1016/j.hlc.2013.04.031
pub.1053553490,Examining Renal Impairment as a Risk Factor for Acute Coronary Syndrome: A Prospective Observational Study,2013,10.1016/j.annemergmed.2013.01.011
pub.1052514390,First Experience of Continuous High Dose Intravenous Frusemide in the Community for End Stage Heart Failure,2013,10.1016/j.hlc.2013.04.073
pub.1034161929,Clinical Outcomes of Medical Therapy for Angiographically Intermediate Lesions with Non Flow-Limiting Stenosis – A Christchurch Experience,2013,10.1016/j.hlc.2013.04.032
pub.1009069366,Are We Reaching Target LDL-Cholesterol (LDL-C) Levels After Acute Myocardial Infarction (AMI),2013,10.1016/j.hlc.2013.04.039
pub.1078796119,Electromagnetic Tomography via Source-Space-ICA,2013,10.1109/embc.2013.6609431
pub.1047385916,An Algorithmic Approach to Perineal Reconstruction After Cancer Resection—Experience From Two International Centers,2013,10.1097/sap.0b013e3182414485
pub.1000034385,The population pharmacokinetics of allopurinol and oxypurinol in patients with gout,2013,10.1007/s00228-013-1478-8
pub.1046111237,Off-line breath acetone analysis in critical illness,2013,10.1088/1752-7155/7/3/037102
pub.1017461458,Henoch–Schönlein purpura in a renal transplant recipient with prior IgA nephropathy following influenza vaccination,2013,10.1093/ckj/sft029
pub.1022491830,The urine output definition of acute kidney injury is too liberal,2013,10.1186/cc12784
pub.1001591189,Clinically Insignificant Effect of Supplemental Vitamin C on Serum Urate in Patients With Gout: A Pilot Randomized Controlled Trial,2013,10.1002/art.37925
pub.1036249376,Justification and implications of the introduction of an expanded Close Marking System for the Fellowship Examination,2013,10.1111/ans.12191
pub.1006327730,Predictors of poor outcome in patients w ith autoimmune hepatitis: A population‐based study,2013,10.1002/hep.26290
pub.1041929533,A Population Pharmacokinetic Model for Low-Dose Methotrexate and its Polyglutamated Metabolites in Red Blood Cells,2013,10.1007/s40262-013-0052-y
pub.1024761680,Fluid-Volume Assessment in the Investigation of Acute Heart Failure,2013,10.1007/s40138-013-0010-x
pub.1053495289,Impact of the Christchurch Earthquakes on Hospital Staff,2013,10.1017/s1049023x1300023x
pub.1006395942,Fine Tuning Risk Stratification for Atrial Fibrillation*,2013,10.1016/j.jacc.2013.02.066
pub.1007356790,Comparison of cough reflex test against instrumental assessment of aspiration,2013,10.1016/j.physbeh.2013.05.004
pub.1012418543,In reply,2013,10.1016/j.annemergmed.2012.12.004
pub.1078752743,Myocarditis associated with Campylobacter jejuni.,2013,
pub.1125596545,A phase I/II study of the vascular disrupting agent BNC105P in combination with gemcitabine-carboplatin in partially platinum-sensitive ovarian cancer patients in first or second relapse: An international collaborative group trial of ANZGOG and HOG.,2013,10.1200/jco.2013.31.15_suppl.tps5612
pub.1125596518,INTEGRATE: A randomized phase II double-blind placebo-controlled study of regorafenib in refractory advanced esophagogastric cancer (AOGC)—A study by the Australasian Gastrointestinal Trials Group (AGITG).,2013,10.1200/jco.2013.31.15_suppl.tps4157
pub.1125596547,PARAGON: Phase II study of aromatase inhibitors in women with potentially hormone responsive recurrent/metastatic gynecologic neoplasms: ANZGOG 0903.,2013,10.1200/jco.2013.31.15_suppl.tps5614
pub.1125641311,Adjuvant radiotherapy after lymphadenectomy in melanoma patients: Final results of an intergroup randomized trial (ANZMTG 0.1.02/TROG 02.01).,2013,10.1200/jco.2013.31.15_suppl.9001
pub.1064357737,White matter microstructure deteriorates across cognitive stages in Parkinson disease,2013,10.1212/wnl.0b013e3182929f62
pub.1078748300,The high volume debate in a low volume country: centralisation of oesophageal resection in New Zealand.,2013,
pub.1078748301,"Reduction mammaplasty and resource allocation--are patients being treated fairly? An examination of the current New Zealand situation, and looking towards the future.",2013,
pub.1053127207,Predictors for developing intestinal failure in patients with Crohn's disease,2013,10.1111/jgh.12115
pub.1042865141,Transfer of Doxazosin into Breast Milk,2013,10.1177/0890334412473203
pub.1031899875,Suppression of CD3/CD28 antibody stimulated responses by human granulocytic myeloid-derived suppressor cells: Fact or artefact?,2013,10.1016/j.imlet.2013.05.009
pub.1033486055,Nasogastric Aspiration as an Indicator for Feed Absorption in Model-Based Glycemic Control in Neonatal Intensive Care,2013,10.1177/193229681300700317
pub.1046518823,Fecal Calprotectin Does Not Predict Endoscopic Remission in Inflammatory Bowel Disease,2013,10.1097/mib.0b013e31828dc6d3
pub.1012271202,"To nasendoscope or not to nasendoscope, that is the question",2013,10.1007/s00405-012-2303-1
pub.1007691344,"Impact of age, phenotype and cardio‐renal function on plasma C‐type and B‐type natriuretic peptide forms in an adult population",2013,10.1111/cen.12035
pub.1064887323,The 2012 ABC orthopaedic fellowship in North America: May 24 to July 2.,2013,10.1302/0301-620x.95b5.31912
pub.1008936773,Predicting patient dissatisfaction following laparoscopic Nissen fundoplication: an analysis of symptoms,2013,10.1007/s00464-012-2630-8
pub.1029569348,Whose name is it anyway? Varying patterns of possessive usage in eponymous neurodegenerative diseases,2013,10.7717/peerj.67
pub.1057287290,Patterns of hearing loss following retrosigmoid excision of unilateral vestibular schwannoma.,2013,10.1055/s-0033-1342921
pub.1059312381,Management of Primary Group A Streptococcal Peritonitis: A Systematic Review,2013,10.1089/sur.2012.038
pub.1003862310,Black sentinel lymph node and ‘scary stickers’,2013,10.1016/j.bjps.2012.08.021
pub.1050070229,Simple Mastectomy and Axillary Lymph Node Biopsy Performed Under Paravertebral Block and Light Sedation in a Patient With Severe Cardiorespiratory Comorbidities: Proposed Management of Choice in High-Risk Breast Surgery Patients,2013,10.1016/j.clbc.2012.12.003
pub.1038582667,Exclusive enteral nutrition and induction of remission of active Crohn’s disease in children,2013,10.1586/eci.13.12
pub.1023145284,Cardiac biomarkers in acute myocardial infarction,2013,10.1016/j.ijcard.2012.01.081
pub.1017023073,Paediatric Growth Charts: How Do We Use Them and Can We Use Them Better?,2013,10.1111/jpc.12146
pub.1052484839,Are patients admitted to emergency departments with regular supraventricular tachycardia (SVT) treated appropriately?,2013,10.7861/clinmedicine.13-2-146
pub.1005943468,Infection‐related hospital admissions after transrectal biopsy of the prostate,2013,10.1111/ans.12073
pub.1029379183,Hemiarthroplasty performed under transversus abdominis plane block in a patient with severe cardiorespiratory disease,2013,10.1111/anae.12108
pub.1041195648,At the heart of the arterial baroreflex: a physiological basis for a new classification of carotid sinus hypersensitivity,2013,10.1111/joim.12042
pub.1036552404,Effects of introducing an enhanced recovery after surgery programme for patients undergoing open hepatic resection,2013,10.1111/j.1477-2574.2012.00578.x
pub.1035216495,Transurethral prostate resection for urinary retention: does age affect outcome?,2013,10.1111/ans.12014
pub.1042029732,Outcomes of Infected Abdominal Aortic Grafts Managed with Antimicrobial Therapy and Graft Retention in an Unselected Cohort,2013,10.1016/j.ejvs.2013.01.019
pub.1034550834,Reply,2013,10.1002/hep.25968
pub.1078734630,Holding on or moving forward?,2013,
pub.1014873629,Generalization of Youden index for multiple‐class classification problems applied to the assessment of externally validated cognition in Parkinson disease screening,2013,10.1002/sim.5592
pub.1018472361,ANP and BNP Responses to Dehydration in the One-Humped Camel and Effects of Blocking the Renin-Angiotensin System,2013,10.1371/journal.pone.0057806
pub.1022861657,Development and optimisation of stochastic targeted (STAR) glycaemic control for pre-term infants in neonatal intensive care,2013,10.1016/j.bspc.2012.08.002
pub.1078699275,Simultaneous two-vessel very-late stent thrombosis of everolimus-eluting stents.,2013,
pub.1034774547,Cardiac Risk Stratification Scoring Systems for Suspected Acute Coronary Syndromes in the Emergency Department,2013,10.1007/s40138-012-0004-0
pub.1028620173,Perianal Disease Combined With NOD2 Genotype Predicts Need for IBD-related Surgery in Crohn’s Disease Patients From a Population-based Cohort,2013,10.1097/mcg.0b013e318258314d
pub.1078708637,Chronic refractory dyspnoea--evidence based management.,2013,
pub.1033913539,Insulin Glargine in the intensive care unit: A model-based clinical trial design,2013,10.1016/j.bspc.2012.09.004
pub.1022170002,Quantification of hydrogen cyanide (HCN) in breath using selected ion flow tube mass spectrometry—HCN is not a biomarker of Pseudomonas in chronic suppurative lung disease,2013,10.1088/1752-7155/7/1/017105
pub.1019332238,Daily Evolution of Insulin Sensitivity Variability with Respect to Diagnosis in the Critically Ill,2013,10.1371/journal.pone.0057119
pub.1083394934,RAD001 and zoledronic acid in patients with renal cell carcinoma with bone metastases (RAZOR): A randomized phase II trial.,2013,10.1200/jco.2013.31.6_suppl.402
pub.1078698765,"Wrapped in controversy: trends in fundoplication at myotomy for achalasia in Christchurch, New Zealand.",2013,
pub.1078698764,A dedicated dermatology clinic for renal transplant recipients: first 5 years of a New Zealand experience.,2013,
pub.1012416993,Musculoskeletal trauma,2013,10.1097/mej.0b013e3283573130
pub.1017599291,Rifampicin and dabigatran etexilate: a place for laboratory coagulation monitoring,2013,10.1111/j.1365-2125.2012.04408.x
pub.1006512499,Validation of subject-specific cardiovascular system models from porcine measurements,2013,10.1016/j.cmpb.2011.10.013
pub.1030670745,Impact of variation in patient response on model-based control of glycaemia in critically ill patients,2013,10.1016/j.cmpb.2011.08.007
pub.1002518036,Genetic Susceptibility in IBDOverlap Between Ulcerative Colitis and Crohn's Disease,2013,10.1097/mib.0b013e3182810041
pub.1043635070,Designing clinical trials to bring wound products to market,2013,10.1111/j.1742-481x.2011.00907.x
pub.1026027665,"Response to: The interaction of Sjogren’s syndrome, gastroesophageal reflux and sleep by Tufik et al.",2013,10.1016/j.sleep.2012.10.004
pub.1002216257,Assessment of ventricular contractility and ventricular-arterial coupling with a model-based sensor,2013,10.1016/j.cmpb.2011.11.009
pub.1009532695,Antibiotics may not improve short-term or long-term outcomes in acute uncomplicated diverticulitis,2013,10.1136/eb-2012-100762
pub.1042949644,Vasovagal Syncope New Physiologic Insights,2013,10.1016/j.ccl.2012.10.010
pub.1048871470,Survival of myeloma patients following the introduction of thalidomide as a second‐line therapy: a retrospective study at a single New Zealand centre,2013,10.1111/j.1445-5994.2012.02819.x
pub.1064887240,Cementless fixation in Oxford unicompartmental knee replacement: a multicentre study of 1000 knees.,2013,10.1302/0301-620x.95b2.30411
pub.1002292873,Application of a spring‐dashpot system to clinical lung tumor motion data,2013,10.1118/1.4788643
pub.1036578265,Clinical and intravascular imaging outcomes at 1 and 2 years after implantation of absorb everolimus eluting bioresorbable vascular scaffolds in small vessels. Late lumen enlargement: does bioresorption matter with small vessel size? Insight from the ABSORB cohort B trial,2013,10.1136/heartjnl-2012-302598
pub.1040414312,Nucleotide Polymerase Inhibitor Sofosbuvir plus Ribavirin for Hepatitis C,2013,10.1056/nejmoa1208953
pub.1010586700,Impact of prandial status on the comparison of capillary glucose meter and venous plasma glucose measurements in healthy volunteers,2013,10.1258/acb.2012.012084
pub.1023685062,Gout and its comorbidities: implications for therapy,2013,10.1093/rheumatology/kes211
pub.1024516297,Hypoxemia in Healthy Subjects at Moderate Altitude,2013,10.3357/asem.3366.2013
pub.1050870297,A Simple High-Performance Liquid Chromatography Method for Simultaneous Determination of Three Triazole Antifungals in Human Plasma,2013,10.1128/aac.00768-12
pub.1040850965,Impact of obesity on the cost of major colorectal surgery,2013,10.1002/bjs.8978
pub.1008820632,Comparison of Current Treatment Practices for Preserved and Reduced Left Ventricular Ejection Fraction: The New Zealand Heart Failure Registry,2013,10.1016/j.hlc.2013.05.173
pub.1010214885,Diagnosis of Acute Myocardial Infarction in Emergency Patients with Chest Pain Using a Two Hour Algorithm with Highly Sensitive Troponin I Assay Results,2013,10.1016/j.hlc.2013.05.084
pub.1048510511,Cochlear implantation in mitochondrial deafness due to A7445G mutation,2013,10.1179/1754762811y.0000000030
pub.1030953495,Prospective study of healthy older drivers: No increase in crash involvement or traffic citations at 24months following a failed on-road assessment,2013,10.1016/j.trf.2012.08.012
pub.1028762357,"Differences Between NZ European and NZ Maori in Characteristics, Treatments and Outcomes of Patients Hospitalised for Heart Failure: New Zealand Heart Failure Registry",2013,10.1016/j.hlc.2013.05.176
pub.1030316065,Current prospects for interferon‐free treatment of hepatitis C in 2012,2013,10.1111/jgh.12028
pub.1040632852,A Study Comparing Diagnostic Accuracy of High Sensitivity Assays of Troponin I and Troponin T for Myocardial Infarction Within Two Hours of Presentation to the Emergency Room,2013,10.1016/j.hlc.2013.05.494
pub.1012825713,Relative recovery of haematopoietic stem cell products after cryogenic storage of up to 19 years,2013,10.1038/bmt.2012.97
pub.1027325883,Identification of Low Risk Emergency Patients with Symptoms of Possible Acute Coronary Syndrome: External Validation of the Vancouver Chest Pain Rule,2013,10.1016/j.hlc.2013.05.100
pub.1036408154,"Improving Interventional Management of Acute Coronary Syndrome (ACS) Patients in New Zealand (NZ): A Comparison of the 2002, 2007 and 2012 National ACS Audits",2013,10.1016/j.hlc.2013.05.519
pub.1026307822,A Review of Current Practices in Treatment of Patients Hospitalised for Heart Failure: The New Zealand Heart Failure Registry,2013,10.1016/j.hlc.2013.05.165
pub.1022476935,A perceptual discrimination task results in greater facilitation of voluntary saccades in Parkinson's disease patients,2013,10.1111/ejn.12033
pub.1050045224,Diagnosis of AMI Using Sex-Specific Cut-Off Values of a Highly Sensitive Troponin I Assay in Emergency Department Patients With Chest Pain,2013,10.1016/j.hlc.2013.05.085
pub.1036269394,VF Frequency is Influenced by Cardiac Structure,2013,10.1016/j.hlc.2013.05.245
pub.1036839683,The Use of Computed Tomography of Pulmonary Angiogram in a District Hospital,2013,10.1155/2013/582413
pub.1029475274,Measurement of early wear rates with X3 polyethylene and 36-mm femoral heads in young patients – a prospective study,2013,10.1097/bco.0b013e31829cc4c9
pub.1002289986,Nutritional Management of Inflammatory Bowel Disease,2013,10.1007/978-1-4614-5061-0_28
pub.1053231485,"The Christchurch Earthquake: Crush Injury, Neuropathic Pain, and Posttraumatic Stress Disorder",2013,10.1155/2013/973234
pub.1019009136,Evaluation of a Model-Based Hemodynamic Monitoring Method in a Porcine Study of Septic Shock,2013,10.1155/2013/505417
pub.1048478632,Inflammatory Bowel Disease Therapies and Gut Function in a Colitis Mouse Model,2013,10.1155/2013/909613
pub.1019196606,The Challenges Facing Training in Pediatric Surgery Worldwide,2013,10.3389/fped.2013.00024
pub.1050055616,"Feasibility, acceptability and preferences for intraperitoneal chemotherapy with paclitaxel and cisplatin after optimal debulking surgery for ovarian and related cancers: an ANZGOG study",2013,10.3802/jgo.2013.24.4.359
pub.1008183400,Trends and predictors of rehospitalisation following an acute coronary syndrome: report from the Australian and New Zealand population of the Global Registry of Acute Coronary Events (GRACE),2012,10.1136/heartjnl-2012-302532
pub.1061528947,STAR Development and Protocol Comparison,2012,10.1109/tbme.2012.2214384
pub.1001080773,Physiological relevance and performance of a minimal lung model – an experimental study in healthy and acute respiratory distress syndrome model piglets,2012,10.1186/1471-2466-12-59
pub.1048420200,"Atypical subtrochanteric fractures, bisphosphonates, blinded radiological review",2012,10.1111/j.1445-2197.2012.06199.x
pub.1038376472,Lemierre's syndrome: Diagnosis in the emergency department,2012,10.1111/1742-6723.12010
pub.1024784287,Variability of plasma and urine betaine in diabetes mellitus and its relationship to methionine load test responses: an observational study,2012,10.1186/1475-2840-11-34
pub.1009960676,Beat-to-beat estimation of the continuous left and right cardiac elastance from metrics commonly available in clinical settings,2012,10.1186/1475-925x-11-73
pub.1042835832,The influence of motor and cognitive impairment upon visually-guided saccades in Parkinson's disease,2012,10.1016/j.neuropsychologia.2012.09.025
pub.1093655567,Assessing Microcirculation Condition in Critical Illness Using the Pulse Oximeter's Concept,2012,10.1109/iecbes.2012.6498030
pub.1049674111,Algorithmic processing of pressure waveforms to facilitate estimation of cardiac elastance,2012,10.1186/1475-925x-11-28
pub.1005189189,Examining the Signs and Symptoms Experienced by Individuals With Suspected Acute Coronary Syndrome in the Asia-Pacific Region: A Prospective Observational Study,2012,10.1016/j.annemergmed.2012.05.008
pub.1003644115,Difficult venepuncture – it was all in the head!,2012,10.1111/j.1365-3148.2012.01203.x
pub.1078667695,Keratin-based Wound Care Products for Treatment of Resistant Vascular Wounds.,2012,
pub.1025733171,Comparison of early biomarker strategies with the Heart Foundation of Australia/Cardiac Society of Australia and New Zealand guidelines for risk stratification of emergency department patients with chest pain,2012,10.1111/1742-6723.12008
pub.1012774549,Second pilot trials of the STAR-Liege protocol for tight glycemic control in critically ill patients,2012,10.1186/1475-925x-11-58
pub.1002953156,Variability of insulin sensitivity during the first 4 days of critical illness: implications for tight glycemic control,2012,10.1186/2110-5820-2-17
pub.1029706831,Spectral CT of carotid atherosclerotic plaque: comparison with histology,2012,10.1007/s00330-012-2538-7
pub.1014145557,Clarifying the American Society of Clinical Oncology Practice Guideline for Chemotherapy Dosing for Obese Adults,2012,10.1200/jco.2012.44.1626
pub.1071542886,Comparison of the 2010 American College of Rheumatology/European League Against Rheumatism and the 1987 American Rheumatism Association classification criteria for rheumatoid arthritis in an early arthritis cohort in New Zealand.,2012,10.3899/jrheum.120226
pub.1026377267,The role of cardiac computed tomography in assessment of acute chest pain,2012,10.1016/j.hlc.2012.04.011
pub.1000005560,Perspective on dabigatran etexilate dosing: why not follow standard pharmacological principles?,2012,10.1111/j.1365-2125.2012.04266.x
pub.1064886860,"A prospective, randomised controlled trial comparing ceramic-on-metal and metal-on-metal bearing surfaces in total hip replacement.",2012,10.1302/0301-620x.94b11.29343
pub.1038301876,The experiences of commercial kidney donors: thematic synthesis of qualitative research,2012,10.1111/j.1432-2277.2012.01534.x
pub.1048808712,Effect of activated human polymorphonuclear leucocytes on T lymphocyte proliferation and viability,2012,10.1111/imm.12004
pub.1037108089,"Desperation, Despair, and Debasement: Thematic Synthesis of Qualitative Research on the Experiences of Commercial Kidney Donors",2012,10.1097/00007890-201211271-02172
pub.1037820738,First pilot trial of the STAR-Liege protocol for tight glycemic control in critically ill patients,2012,10.1016/j.cmpb.2011.07.003
pub.1015638796,Pilot Study of the SPRINT Glycemic Control Protocol in a Hungarian Medical Intensive Care Unit,2012,10.1177/193229681200600628
pub.1052105483,Method for identifying eligible individuals for a prevalence survey in the absence of a disease register or population register,2012,10.1111/j.1445-5994.2012.02754.x
pub.1032116327,Successful management of a large air embolus during an extended right hepatectomy with an emergency cardiopulmonary bypass,2012,10.1111/j.1477-2574.2012.00550.x
pub.1046541188,Host–microbe interactions have shaped the genetic architecture of inflammatory bowel disease,2012,10.1038/nature11582
pub.1078649639,"Deaths due to differentiated thyroid cancer: a South Island, New Zealand experience: 1984-2009.",2012,
pub.1028301385,Has primary sclerosing cholangitis associated with Crohn's disease a better outcome?,2012,10.1016/j.crohns.2012.05.013
pub.1036164489,A reappraisal of adult thoracic surface anatomy,2012,10.1002/ca.22091
pub.1041600255,Gastrointestinal: Large heterotopic gastric mucosa in the rectum,2012,10.1111/j.1440-1746.2012.07224.x
pub.1059288061,Pharmacovigilance in Hospice/Palliative Care: Rapid Report of Net Clinical Effect of Metoclopramide,2012,10.1089/jpm.2012.0111
pub.1033584905,Age and pancreaticoduodenctomy: is it really about mortality?,2012,10.1111/j.1477-2574.2012.00505.x
pub.1031650254,A reappraisal of adult abdominal surface anatomy,2012,10.1002/ca.22119
pub.1004052660,TCT-581 Multislice Computed Tomography Angiography as a Non-invasive Angiographic and Functional Assessment of the 18-Months Performance of a Novel Radiolucent Bio-resorbable Coronary Scaffolding Device (ABSORB Cohort B Trial),2012,10.1016/j.jacc.2012.08.616
pub.1032462642,The Global Lung Initiative 2012 reference values reflect contemporary Australasian spirometry,2012,10.1111/j.1440-1843.2012.02232.x
pub.1030182591,"Use of Recreational Drug 1,3-Dimethylethylamine (DMAA) Associated With Cerebral Hemorrhage",2012,10.1016/j.annemergmed.2012.04.008
pub.1053495114,S100A12 in EDTA plasma – A cautionary tale,2012,10.1016/j.crohns.2012.05.020
pub.1022302338,A novel contiguous gene deletion of AVPR2 and ARHGAP4 genes in male dizygotic twins with nephrogenic diabetes insipidus and intellectual disability,2012,10.1002/ajmg.a.35591
pub.1053623262,A 2-hour thrombolysis in myocardial infarction score outperforms other risk stratification tools in patients presenting with possible acute coronary syndromes Comparison of chest pain risk stratification tools,2012,10.1016/j.ahj.2012.06.025
pub.1049797093,"Low incidence and prevalence of primary biliary cirrhosis in Canterbury, New Zealand: a population-based study",2012,10.1007/s12072-011-9329-0
pub.1025344847,Enhanced recovery after surgery versus conventional care in colonic and rectal surgery,2012,10.1111/j.1445-2197.2012.06139.x
pub.1041392802,Anatomical planes: Are we teaching accurate surface anatomy?,2012,10.1002/ca.22104
pub.1029760383,Evaluating cap-assisted colonoscopy: the relevance of study design,2012,10.1136/gutjnl-2012-302133
pub.1019068227,Vertebral levels of key landmarks in the neck,2012,10.1002/ca.22124
pub.1037679926,High-sensitivity troponin T for early rule-out of myocardial infarction in recent onset chest pain,2012,10.1136/emermed-2011-200222
pub.1022419790,Current relevance of pharmacogenetics in immunomodulation treatment for Crohn's disease,2012,10.1111/j.1440-1746.2012.07220.x
pub.1078652450,The Time Out Procedure: have we changed our practice?,2012,
